<!ELEMENT listado (futuros+,divisas+,bonos+,letras+)>
<!ELEMENT futuros (producto, mercado?,(madrid|ny|frankfurt|tokyo))>
<!ELEMENT divisas (nombre, tipocambio+,(madrid|ny|frankfurt|tokyo))>
<!ELEMENT bonos (paisprocedencia, valorminimo, valormaximo, valordeseado, (madrid|ny|frankfurt|tokyo))>
<!ELEMENT letras (tipointeres, (espanya|eeuu|alemania|japon))>

<!ELEMENT producto (#PCDATA)>
<!ELEMENT mercado (#PCDATA)>
<!ELEMENT tipocambio (#PCDATA)>
<!ELEMENT nombre (#PCDATA)>
<!ELEMENT paisprocedencia (#PCDATA)>
<!ELEMENT valorminimo (#PCDATA)>
<!ELEMENT valormaximo (#PCDATA)>
<!ELEMENT valordeseado (#PCDATA)>
<!ELEMENT tipointeres (#PCDATA)>

<!ATTLIST futuros precio CDATA #REQUIRED>
<!ATTLIST divisas precio CDATA #REQUIRED>
<!ATTLIST bonos precio CDATA #REQUIRED>
<!ATTLIST letras precio CDATA #REQUIRED>
<!ATTLIST divisas estable (si|no) #IMPLIED >
<!ATTLIST bonos estable (si|no) #IMPLIED >

<!ELEMENT madrid EMPTY>
<!ELEMENT ny EMPTY>
<!ELEMENT frankfurt EMPTY>
<!ELEMENT tokyo EMPTY>
<!ELEMENT espanya EMPTY>
<!ELEMENT eeuu EMPTY>
<!ELEMENT alemania EMPTY>
<!ELEMENT japon EMPTY>
