<?xml version="1.0" encoding="UTF-8"?>

<!DOCTYPE listado SYSTEM "../DTD2/Robert_Torrent_Nahuel_DTD2_5.dtd">

<listado>
    <futuros precio="5">
        <producto>tractor</producto>
        <mercado>nose</mercado>
        <madrid />
    </futuros>
    <divisas precio="5">
        <nombre>divisa1</nombre>
        <tipocambio>dolares</tipocambio>
        <ny />
    </divisas>
    <bonos precio="5">
        <paisprocedencia>alemania</paisprocedencia>
        <valorminimo>12</valorminimo>
        <valormaximo>20</valormaximo>
        <valordeseado>15</valordeseado>
        <frankfurt />
    </bonos>
    <letras precio="5">
        <tipointeres>alguno</tipointeres>
        <espanya />
    </letras>
</listado>